<?xml version="1.0" encoding="UTF-8" standalone="no"?>
<!DOCTYPE engines SYSTEM "ArchiveDaemon.dtd">
<engines>
   <engine>
      <desc>Demo</desc>
      <port>4813</port>
      <config>/arch/RF/llrf/llrf.xml</config>
   </engine>
   <engine>
      <desc>Demo 2</desc>
      <port>4814</port>
      <config>/arch/RF/hprf/hprf.xml</config>
      <daily>02:00</daily>
      <copy>dataserver:/arch/RF/hprf</copy>
   </engine>
</engines>
